{"assetManifest":"assets/bidari-ombattu/assets.manifest.json","audio":{"ambience":null,"music":null},"campaignIds":[],"cinematicManifest":null,"content":{"aboutSummaryKey":"sma.bidari-ombattu.about","glossaryIds":[],"provenanceId":"sma.bidari-ombattu.provenance","teachingIds":["sma.bidari-ombattu.teaching.start-1","sma.bidari-ombattu.teaching.mill-1","sma.bidari-ombattu.teaching.remove-1","sma.bidari-ombattu.teaching.win-1","sma.bidari-ombattu.teaching.lose-1"]},"game":"sma","id":"bidari-ombattu","kannadaTitleKey":"sma.bidari-ombattu.title.kn","realistic":true,"render":{"accessibilityPalette":"bidari-ombattu","bloom":0.14,"boardTexture":"assets/bidari-ombattu/board.jpg","cameraMood":"night-metal","environment":null,"lighting":{"ambient":{"color":"#aeb8c4","intensity":0.45},"hero":{"angle":0.8,"color":"#ffdca0","intensity":1.5,"penumbra":0.7},"key":{"color":"#ffe4b0","intensity":1.5},"rim":{"color":"#cbd3db","intensity":0.9}},"limits":{"desktopParticles":48,"maxPixelRatio":2,"maxShadowMap":1024,"mobileParticles":12},"materials":[{"baseColor":"#1a1b1f","emissive":"#000000","emissiveIntensity":0,"environmentIntensity":1.1,"metalness":0.85,"role":"board","roughness":0.28}],"palette":[{"color":"#08090b","role":"background"},{"color":"#131417","role":"surface"},{"color":"#1a1b1f","role":"board"},{"color":"#dfe4ea","role":"node"},{"color":"#e8edf2","role":"piece-0"},{"color":"#b98a4e","role":"piece-1"},{"color":"#cbd3db","role":"accent"},{"color":"#eef2f6","role":"text"}],"pieceStyle":"polished-metal","poster":"assets/bidari-ombattu/poster.jpg"},"rulesetCompatibility":[{"id":"sma.base","version":1}],"schema":2,"titleKey":"sma.bidari-ombattu.title"}
